{
  "metadata": {
    "jurisdiction": "NSW",
    "report_type": "combined",
    "detected_report_type": "combined",
    "address": null,
    "date_received": null,
    "source_file": "NSW_condition_report.pdf",
    "total_pages": 12,
    "extraction_timestamp": "2026-07-01T12:58:43.962255+00:00",
    "extractor_version": "1.0.0"
  },
  "rooms": [
    {
      "room_name": "ENTRANCE/HALL",
      "page_number": 3,
      "items": [
        {
          "item_name": "front door/screen door/security door",
          "start_of_tenancy": {
            "clean": null,
            "undamaged": null,
            "working": null,
            "landlord_comments": null,
            "tenant_agrees": null,
            "tenant_comments": null
          },
          "end_of_tenancy": {
            "clean": null,
            "undamaged": null,
            "working": null,
            "comments": null,
            "tenant_agrees": null
          }
        },
        {
          "item_name": "walls/picture hooks",
          "start_of_tenancy": {
            "clean": null,
            "undamaged": null,
            "working": null,
            "landlord_comments": null,
            "tenant_agrees": null,
            "tenant_comments": null
          },
          "end_of_tenancy": {
            "clean": null,
            "undamaged": null,
            "working": null,
            "comments": null,
            "tenant_agrees": null
          }
        },
        {
          "item_name": "doorway frames",
          "start_of_tenancy": {
            "clean": null,
            "undamaged": null,
            "working": null,
            "landlord_comments": null,
            "tenant_agrees": null,
            "tenant_comments": null
          },
          "end_of_tenancy": {
            "clean": null,
            "undamaged": null,
            "working": null,
            "comments": null,
            "tenant_agrees": null
          }
        },
        {
          "item_name": "windows/screens/window safety devices",
          "start_of_tenancy": {
            "clean": null,
            "undamaged": null,
            "working": null,
            "landlord_comments": null,
            "tenant_agrees": null,
            "tenant_comments": null
          },
          "end_of_tenancy": {
            "clean": null,
            "undamaged": null,
            "working": null,
            "comments": null,
            "tenant_agrees": null
          }
        },
        {
          "item_name": "ceiling/light fittings",
          "start_of_tenancy": {
            "clean": null,
            "undamaged": null,
            "working": null,
            "landlord_comments": null,
            "tenant_agrees": null,
            "tenant_comments": null
          },
          "end_of_tenancy": {
            "clean": null,
            "undamaged": null,
            "working": null,
            "comments": null,
            "tenant_agrees": null
          }
        },
        {
          "item_name": "blinds/curtains",
          "start_of_tenancy": {
            "clean": null,
            "undamaged": null,
            "working": null,
            "landlord_comments": null,
            "tenant_agrees": null,
            "tenant_comments": null
          },
          "end_of_tenancy": {
            "clean": null,
            "undamaged": null,
            "working": null,
            "comments": null,
            "tenant_agrees": null
          }
        },
        {
          "item_name": "lights/power points/door bell",
          "start_of_tenancy": {
            "clean": null,
            "undamaged": null,
            "working": null,
            "landlord_comments": null,
            "tenant_agrees": null,
            "tenant_comments": null
          },
          "end_of_tenancy": {
            "clean": null,
            "undamaged": null,
            "working": null,
            "comments": null,
            "tenant_agrees": null
          }
        },
        {
          "item_name": "skirting boards",
          "start_of_tenancy": {
            "clean": null,
            "undamaged": null,
            "working": null,
            "landlord_comments": null,
            "tenant_agrees": null,
            "tenant_comments": null
          },
          "end_of_tenancy": {
            "clean": null,
            "undamaged": null,
            "working": null,
            "comments": null,
            "tenant_agrees": null
          }
        },
        {
          "item_name": "floor coverings",
          "start_of_tenancy": {
            "clean": null,
            "undamaged": null,
            "working": null,
            "landlord_comments": null,
            "tenant_agrees": null,
            "tenant_comments": null
          },
          "end_of_tenancy": {
            "clean": null,
            "undamaged": null,
            "working": null,
            "comments": null,
            "tenant_agrees": null
          }
        },
        {
          "item_name": "other",
          "start_of_tenancy": {
            "clean": null,
            "undamaged": null,
            "working": null,
            "landlord_comments": null,
            "tenant_agrees": null,
            "tenant_comments": null
          },
          "end_of_tenancy": {
            "clean": null,
            "undamaged": null,
            "working": null,
            "comments": null,
            "tenant_agrees": null
          }
        }
      ]
    },
    {
      "room_name": "LOUNGE ROOM",
      "page_number": 3,
      "items": [
        {
          "item_name": "walls/picture hooks",
          "start_of_tenancy": {
            "clean": null,
            "undamaged": null,
            "working": null,
            "landlord_comments": null,
            "tenant_agrees": null,
            "tenant_comments": null
          },
          "end_of_tenancy": {
            "clean": null,
            "undamaged": null,
            "working": null,
            "comments": null,
            "tenant_agrees": null
          }
        },
        {
          "item_name": "doors/doorway frames",
          "start_of_tenancy": {
            "clean": null,
            "undamaged": null,
            "working": null,
            "landlord_comments": null,
            "tenant_agrees": null,
            "tenant_comments": null
          },
          "end_of_tenancy": {
            "clean": null,
            "undamaged": null,
            "working": null,
            "comments": null,
            "tenant_agrees": null
          }
        },
        {
          "item_name": "windows/screens/window safety devices",
          "start_of_tenancy": {
            "clean": null,
            "undamaged": null,
            "working": null,
            "landlord_comments": null,
            "tenant_agrees": null,
            "tenant_comments": null
          },
          "end_of_tenancy": {
            "clean": null,
            "undamaged": null,
            "working": null,
            "comments": null,
            "tenant_agrees": null
          }
        },
        {
          "item_name": "ceiling/light fittings",
          "start_of_tenancy": {
            "clean": null,
            "undamaged": null,
            "working": null,
            "landlord_comments": null,
            "tenant_agrees": null,
            "tenant_comments": null
          },
          "end_of_tenancy": {
            "clean": null,
            "undamaged": null,
            "working": null,
            "comments": null,
            "tenant_agrees": null
          }
        },
        {
          "item_name": "blinds/curtains",
          "start_of_tenancy": {
            "clean": null,
            "undamaged": null,
            "working": null,
            "landlord_comments": null,
            "tenant_agrees": null,
            "tenant_comments": null
          },
          "end_of_tenancy": {
            "clean": null,
            "undamaged": null,
            "working": null,
            "comments": null,
            "tenant_agrees": null
          }
        },
        {
          "item_name": "lights/power points",
          "start_of_tenancy": {
            "clean": null,
            "undamaged": null,
            "working": null,
            "landlord_comments": null,
            "tenant_agrees": null,
            "tenant_comments": null
          },
          "end_of_tenancy": {
            "clean": null,
            "undamaged": null,
            "working": null,
            "comments": null,
            "tenant_agrees": null
          }
        },
        {
          "item_name": "skirting boards",
          "start_of_tenancy": {
            "clean": null,
            "undamaged": null,
            "working": null,
            "landlord_comments": null,
            "tenant_agrees": null,
            "tenant_comments": null
          },
          "end_of_tenancy": {
            "clean": null,
            "undamaged": null,
            "working": null,
            "comments": null,
            "tenant_agrees": null
          }
        },
        {
          "item_name": "floor coverings",
          "start_of_tenancy": {
            "clean": null,
            "undamaged": null,
            "working": null,
            "landlord_comments": null,
            "tenant_agrees": null,
            "tenant_comments": null
          },
          "end_of_tenancy": {
            "clean": null,
            "undamaged": null,
            "working": null,
            "comments": null,
            "tenant_agrees": null
          }
        },
        {
          "item_name": "other",
          "start_of_tenancy": {
            "clean": null,
            "undamaged": null,
            "working": null,
            "landlord_comments": null,
            "tenant_agrees": null,
            "tenant_comments": null
          },
          "end_of_tenancy": {
            "clean": null,
            "undamaged": null,
            "working": null,